{
  "$schema": "https://json-schema.org/draft-07/schema#",
  "$id": "https://smartebooks.sebbrochet.com/smartbook.schema.json",
  "title": "smartbook.json",
  "description": "A smart ebook's descriptor. The same format backs a bundled book under books/<slug>/ and a portable .smartbook package. A book is data only — there is no code file.",
  "type": "object",
  "required": ["schemaVersion", "authorId", "slug", "title", "visibility"],
  "additionalProperties": false,
  "properties": {
    "schemaVersion": {
      "type": "integer",
      "minimum": 1,
      "maximum": 2,
      "description": "Schema version this descriptor is written against. This build writes 2 and reads 1–2."
    },
    "minReaderSchema": {
      "type": "integer",
      "minimum": 1,
      "description": "Oldest reader schema able to render this package. Defaults to schemaVersion. Set it when a newer package is still readable by an older reader."
    },
    "authorId": {
      "type": "string",
      "pattern": "^[a-z0-9]([a-z0-9-]*[a-z0-9])?(\\.[a-z0-9]([a-z0-9-]*[a-z0-9])?)+$",
      "maxLength": 253,
      "description": "Publisher id: a domain you control, e.g. example.com. Scopes this book's identity, so another author's book with the same slug stays a different book. Not the same as `authors`, which is a display byline."
    },
    "edition": {
      "type": "string",
      "pattern": "^(\\d{4}-\\d{2}-\\d{2}|\\d+\\.\\d+\\.\\d+)$",
      "description": "This edition, as an ISO date (2026-09-04) or semver (1.2.0). Restricted to those so editions can be ordered: a free-form version cannot answer whether an imported package is newer than the copy a reader already has."
    },
    "slug": {
      "type": "string",
      "pattern": "^[a-z0-9][a-z0-9-]*$",
      "maxLength": 64,
      "description": "Stable identifier, lowercase with hyphens. Must match the book's folder name."
    },
    "language": {
      "type": "string",
      "pattern": "^[A-Za-z]{2,3}(-[A-Za-z0-9]{2,8})*$",
      "maxLength": 35,
      "description": "BCP 47 tag for the book's prose: fr, en-GB, pt-BR. The reader marks the chapter with it, which decides hyphenation and how a screen reader pronounces the text. One language per book — a work in two languages is two books (SPEC010)."
    },
    "title": { "type": "string", "minLength": 1, "description": "Display title." },
    "description": { "type": "string", "description": "One-line summary, shown on the shelf." },
    "authors": { "type": "array", "items": { "type": "string" }, "description": "Display names." },
    "createdAt": {
      "type": "string",
      "description": "ISO date, e.g. 2026-08-30.",
      "format": "date"
    },
    "cover": {
      "type": "string",
      "description": "Cover image as a packaged asset path, e.g. assets/cover.png. The file must exist in the book folder.",
      "pattern": "^assets/"
    },
    "engine": {
      "type": "object",
      "description": "Engine compatibility range. Advisory only — nothing enforces it.",
      "additionalProperties": false,
      "properties": {
        "min": { "type": "string" },
        "max": { "type": "string" }
      }
    },
    "chapters": {
      "type": "array",
      "description": "Chapters in order. If omitted, they are derived from content/: a numeric filename prefix sets the order and the first heading sets the title.",
      "items": {
        "type": "object",
        "required": ["file"],
        "additionalProperties": false,
        "properties": {
          "file": {
            "type": "string",
            "pattern": "\\.md$",
            "description": "Filename relative to content/, e.g. 01-intro.md."
          },
          "order": { "type": "integer", "description": "Display order." },
          "title": { "type": "string", "description": "Overrides the first heading." },
          "part": {
            "type": "string",
            "description": "The id of a part declared in `parts`. Omit for a chapter that sits outside the grouping, such as a preface or an appendix."
          }
        }
      }
    },
    "unitDepth": {
      "type": "integer",
      "minimum": 2,
      "maximum": 6,
      "description": "The heading depth at which this book's files carry units (2 for ##). A file is then a container of units and the reader is delivered one at a time. Omit for a book whose files are pages."
    },
    "parts": {
      "type": "array",
      "description": "Named groups of chapters, e.g. 'Part I \u2014 Foundations'. Referenced by chapters[].part. A part appears where its first chapter appears, and one no chapter claims is not drawn.",
      "items": {
        "type": "object",
        "required": ["id", "title"],
        "additionalProperties": false,
        "properties": {
          "id": {
            "type": "string",
            "pattern": "^[a-z0-9-]+$",
            "description": "Stable identifier, referenced by chapters[].part."
          },
          "title": { "type": "string", "minLength": 1, "description": "Display title." }
        }
      }
    },
    "assets": {
      "type": "array",
      "items": { "type": "string", "pattern": "^assets/" },
      "description": "Declared asset paths. Each must exist in the book folder."
    },
    "islands": {
      "type": "object",
      "description": "The interactive islands this book uses.",
      "additionalProperties": false,
      "properties": {
        "packs": {
          "type": "object",
          "description": "Island packs beyond the built-ins, keyed by pack name, with per-book options. The platform maps a name to its implementation; the book carries only data.",
          "additionalProperties": { "type": "object" },
          "properties": {
            "chess": {
              "type": "object",
              "additionalProperties": false,
              "properties": {
                "board": {
                  "type": "object",
                  "additionalProperties": false,
                  "properties": {
                    "theme": { "enum": ["brown", "blue", "green", "grey"] },
                    "pieces": { "enum": ["cburnett", "unicode"] },
                    "orientation": { "enum": ["white", "black", "auto"] }
                  }
                }
              }
            },
            "mermaid": {
              "type": "object",
              "additionalProperties": false,
              "properties": {
                "theme": { "enum": ["auto", "default", "neutral", "dark", "forest", "base"] }
              }
            },
            "music": {
              "type": "object",
              "additionalProperties": false,
              "properties": {
                "width": {
                  "type": "number",
                  "description": "Default stave width in pixels. A per-directive width wins."
                },
                "noteNames": {
                  "enum": ["letters", "solfege"],
                  "description": "What this book calls a note when it prints one: C sharp, or Do dièse. Does not affect what :note[…] accepts — both vocabularies are always understood."
                }
              }
            },
            "gamebook": {
              "type": "object",
              "additionalProperties": false,
              "description": "No options yet. A gamebook's rules live in its prose and its choices, not in its descriptor.",
              "properties": {}
            }
          }
        },
        "required": {
          "type": "array",
          "items": { "type": "string" },
          "description": "Canonical island names the content uses. Written automatically on export — you do not need to maintain this by hand."
        }
      }
    },
    "visibility": {
      "enum": ["public", "private"],
      "description": "Publication intent. Required: absent or unrecognised counts as private, and the build refuses to run when anything under books/ is not public. 'private' books belong in a separate repository and ship as .smartbook packages."
    }
  }
}
