{
  "schemaVersion": 2,
  "minReaderSchema": 2,
  "authorId": "sebbrochet.com",
  "language": "en",
  "slug": "chess",
  "visibility": "public",
  "title": "Chess: Boards & Puzzles",
  "description": "Famous games replayed move by move, positions to weigh up, and puzzles that tell you whether you found the move.",
  "authors": ["Smart Ebooks"],
  "createdAt": "2026-08-23",
  "cover": "assets/cover.svg",
  "engine": { "min": "0.1.0" },
  "islands": {
    "packs": {
      "chess": { "board": { "theme": "blue" } }
    }
  },
  "assets": ["assets/cover.svg", "assets/immortal.pgn"],
  "parts": [
    { "id": "reading", "title": "Part I — Reading a game" },
    { "id": "writing", "title": "Part II — Writing one" }
  ],
  "chapters": [
    { "file": "01-chess-basics.md", "order": 1, "part": "reading" },
    { "file": "02-reading-an-annotated-game.md", "order": 2, "part": "reading" },
    { "file": "03-a-game-from-a-file.md", "order": 3, "part": "writing" },
    { "file": "04-a-game-you-can-lay-out.md", "order": 4, "part": "writing" },
    { "file": "05-choosing-a-line.md", "order": 5, "part": "writing" },
    { "file": "06-a-model-game.md", "order": 6, "part": "writing" }
  ]
}
