{
  "schemaVersion": 2,
  "minReaderSchema": 1,
  "authorId": "sebbrochet.com",
  "slug": "guide",
  "visibility": "public",
  "title": "The Smart Ebook Guide",
  "description": "A hands-on tour of the smart-ebook toolkit: directives, islands, and local tracking.",
  "authors": ["Smart Ebooks"],
  "createdAt": "2026-08-22",
  "cover": "assets/cover.svg",
  "engine": { "min": "0.1.0" },
  "islands": {
    "packs": {
      "mermaid": {}
    }
  },
  "chapters": [
    { "file": "01-getting-started.md", "order": 1 },
    { "file": "02-interactivity-toolkit.md", "order": 2 },
    { "file": "03-tracking-progress.md", "order": 3 }
  ],
  "assets": ["assets/cover.svg"]
}
